{"diseaseId": "", "patientId": "", "ageAtDiagnosis": 0, "diagnosis": {"id": "", "label": ""}, "yearOfDiagnosis": 0, "dateOfFirstTreatment": "", "pathologyConfirmation": {"id": "", "label": ""}, "pathology": [{"id": "", "label": ""}], "imagingProcedureProtocol": {"id": "", "label": ""}, "treatment": [{"id": "", "label": ""}]}